,comment,aggression,attack,attn_words
0,you claim to be whatever that means and then accuse me of painting you as evil i need add nothing else to demonstrate the depth of and rational thought that you have to work with you confirm my assumption of christians note the you used is erroneous confused irrational angry and easily moved to your user page should be referenced as an example for,0.0444,0.0232,claim you to be whatever
1,united nations i wonder how long it will take for the proxy that i am using to get removed you see i am a troll and i have been clicking random article and doing minor spelling corrections editing only one word usually a word that is linked to a page and changing it to something funny example changing fish to shark and since i am only editing one word it the vandalism filters hahahaha so go ahead and block me see if i care because i will just find a new proxy and keep doing it i enjoy making work for reviewers and admin,0.0441,0.0225,nations united i wonder for
2,i am english i am i do not want to get blocked again fu k,0.2141,0.201,blocked i am english k
3,i will not even waste my time arguing with the mentally ill from wiki pt,0.2371,0.1812,mentally waste will not ill
4,1 june 2007 utc accepted long ago being a queer that censorship is ok to avoid he's really quite the a stepping homosexual 23 55,0.2307,0.1859,homosexual queer 1 a a
5,why is it the insists on screwing around with my articles have been doing the survivors for 18 months now have been the same format with naming the series all along and all of a sudden insists on vandalizing my articles yet he keeps doing it sigh sigh sigh i am getting sick and tired of nonsense have asked you on numerous occasions to put a stops to his crap and you have done nothing i demand that be blocked from wikipedia for his child like nonsense in playing a game on one ups everytime i work on an article he on playing these games if you do not block him for his nonsense then i want my request to have him blocked forwarded to an administrator who will see playing wikipedia editing games with other editors,0.2537,0.1676,screwing is why the it
6,to whoever enjoys vandalism and changing the county county boundaries are established by the state of california and unless you can show me the law that changed la to orange county then kindly go the hell away,0.2379,0.1776,vandalism to enjoys whoever and
7,mind your own business and stop changing messages to others that are not directed at you wikipedia is already a scam do not contribute to it,0.2396,0.1741,own your business mind and
8,you were too busy accepting sexual from michael lucas in for editing his bio the way he wants it did he rip you a new one it may be all fun and games now but wait until he tells you to do something that you don't want to do then you'll wish you had run far and fast when you had the chance too late now you'll see,0.2389,0.1743,sexual you busy were too
9,reason there is no information about 6 percent greeks in albania so you are a,0.0429,0.0339,reason no a is there
10,bite me that is all cunt,0.9588,0.957,cunt bite all is that
11,warning me if you dare to warn me i dont really give a rip i will delete them and keep on them i am making a new account so,0.2404,0.171,dare warning to a you
12,will arbitration finally be needed to stop the bigoted attacks i fear that certain editors here have not the recent warnings whatsoever and are proceeding full steam ahead with attempting to make this bible article a full one sided pov job with insulting inflammatory and derogatory being directed at all those who take this story seriously there is only one way to get this to end and that is with more level of arbitration we know there are anti christian and anti jewish bigots in the world always have been no doubt about that why do we have to allow them to come here and their non stop the way these sad look at christians and jews whom they always label with derogatory sounding labels like fundamentalist and conservative is of the way hitler felt about jews except these mental include christians as well involving a much greater proportion of the population as their target they are poisoning the environment with their bigotry this is a plea to arbitration for remedy,0.0419,0.0198,bigoted arbitration stop will the
13,user is a ha ha ha,0.1958,0.2096,a ha is ha user
14,self hating jew i think some of the current text of this article may have been stolen from the copyrighted klan encyclopedia entry for nigger lover have a look why are you helping to promote hate speech on wikipedia,0.2284,0.1755,hating jew self nigger i
15,don´t forget to tell your and too,0.0411,0.0304,and too your to forget
16,look who's talking about unfounded accusations this coming from a guy who tries to re define a group people he knows nothing about with unfounded info wow you americans me all the time,0.0406,0.0232,look unfounded americans tries a
17,last warning to you any more talkback and you will suffer at my,0.2183,0.1815,suffer last will you any
18,constructive feedback for you i find you smart intelligent and but rude destructive and counter productive with very narrow and heavily biased about sources etc who lacks vision and bigger picture,0.0404,0.0254,destructive rude intelligent smart and
19,you display your ignorance the in question was paranoid and he was stupid the classic definitions without a of an accurate description isn't an insult censor why you people feel the need to interfere when you don't understand is beyond me when wrote his stupid paranoid i do not support the of however this was short live that does not make sense that sentence takes away from his great it that he did something wrong or something happened and he did not act it has a negative what is the point of that sentence there should be an entire section devoted to his of paying off the national debt subtle propaganda the does not make sense and should be changed or removed that is paranoid and stupid in fact if you're censoring me surely that garbage should also have been censored on the grounds that it is incoherent or whatever you censors use,0.2545,0.1525,ignorance stupid stupid the your
20,i will vandalize your page,0.225,0.172,vandalize will your i page
21,i see you too have become with but then again my plagiarism software gives some reasonable belief you too are one of his numerous sock puppets as you know all to well the clear of at and an of the last but one journal will confirm that view someone said that the club was the mafia of the at least it raised money for good courses according to the times edition i directed you too research shows that 99 of contributors are men 10 are up as many are social my experience suggests they live in north and are mentally ill they fail to grasp that no one reads the copied out they write 97 of wp is read only by the editor the magazine i edited had readers i was not so f k off and i still have 76 copies of i believe the review copies i received as editor belonged to so i gave them back apologies for spelling i m on a boat and like you the water is with sh t regards to your pretend friend john — preceding unsigned comment added by,0.2394,0.1612,too you have i become
22,read the comment as to why i could not post there it will not allow ip's to comment the filter is and it will not even allow ip's to report it as i spelled that out clearly how the hell did u miss that i also noticed you did nothing to the editor who is making frivolous complaints and not notifying those involved did however attempt to get some help on another editors page and also is attempting to silence other editors to continue the articles again read the contributions and it readily apparent what a waste of my damn time wikipedia is done it has become nothing but a bunch of leftist government assistance types trying to spin the whole project to fit their view with an right wing nut thrown in for some fun for the most conservatives are to busy their a es supporting these left wing nuts and social rejects to give a shit about it at wikipedia,0.2633,0.1449,frivolous the read hell complaints
23,paid o,0.1959,0.1944,paid o
24,im not posting their he never provided proof or anything why not give him hell july 14 2006 utc,0.2092,0.1799,hell im not their he
25,i'm sorry but that's a crap answer first many of the same editors are busy and protecting over there second and most importantly it speaks to core wp policies if are applied differently against one article versus another then why would we blind ourselves to that problem or has wp itself become a political arm and one candidate above another,0.038,0.0187,crap sorry but that's many
26,how was that a personal attack he was being a dick so it was fair cop to call him one,0.2156,0.1716,dick attack a a how
27,keep blocked forever he deserves it don't even make him touch any page that mentions microsoft,0.0379,0.0257,blocked keep deserves forever he
28,i agree that keep faggots was needlessly insulting but it was in the edit summary so reverting the edit doesn't help there i don't know if you can even edit the summaries at all anyway i think vote should be counted so i will put it back one more time and if one of you reverts i'll leave it alone,0.2217,0.1645,faggots insulting was needlessly agree
29,boo to you sir boo to you i have to go monitor the hall now boo to you,0.2035,0.179,you boo to sir have
30,i protest that was outrageous,0.0373,0.0247,outrageous protest i was that
31,three comments in a row get help it's sufficient to quote qualified experts with books from universities stating that you keep on quoting fringe and bullshit said,0.2265,0.1594,bullshit comments row three in
32,2 words learn them shut up dont follow me everywhere,0.2062,0.1748,shut up dont them 2
33,sitush how can anyone assume good faith when you have been writing so much against yadavs on that page it is evident from the discussions how conveniently you have been selecting sources for and then conveniently rejecting the same sources for the you are the only person spamming on that article and vandalizing it yes i will contribute to other articles on wiki too but let me first correct things on yadav as so much wrong has been going on there you got banned and now you have got me banned and you will get anyone banned you differs from your biased stand on yadavs but i am not going to give up i will follow all wp policies and will ensure that i get things corrected on yadav and dont let your and personal views dominate that page peace,0.0366,0.0217,how can anyone sitush good
34,unblock material scientist and so is they are both gay with each other,0.2025,0.1766,gay are both with each
35,thank you sir you just proved your,0.0365,0.0264,proved just sir you you
36,series on 4th july on http www net a few ppl left comments saying that the current series is to end on the 4th of july but i believe that this is complete and utter rubbish has anyone heard anything about this,0.0359,0.0184,rubbish utter and complete has
37,oi please do not remove me abusing other wikipedians dickhead oi please do not remove me abusing other wikipedians dickhead oi please do not remove me abusing other wikipedians dickhead oi please do not remove me abusing other wikipedians dickhead oi please do not remove me abusing other wikipedians dickhead oi please do not remove me abusing other wikipedians dickhead oi please do not remove me abusing other wikipedians dickhead oi please do not remove me abusing other wikipedians dickhead oi please do not remove me abusing other wikipedians dickhead oi please do not remove me abusing other wikipedians dickhead oi please do not remove me abusing other wikipedians dickhead oi please do not remove me abusing other wikipedians dickhead oi please do not remove me abusing other wikipedians dickhead oi please do not remove me abusing other wikipedians dickhead oi please do not remove me abusing other wikipedians dickhead oi please do not remove me abusing other wikipedians dickhead oi please do not remove me abusing other wikipedians dickhead oi please do not remove me abusing other wikipedians dickhead oi please do not remove me abusing other wikipedians dickhead oi please do not remove me abusing other wikipedians dickhead oi please do not remove me abusing other wikipedians dickhead oi please do not remove me abusing other wikipedians dickhead oi please do not remove me abusing other wikipedians dickhead oi please do not remove me abusing other wikipedians dickhead oi please do not remove me abusing other wikipedians dickhead oi please do not remove me abusing other wikipedians dickhead oi please do not remove me abusing other wikipedians dickhead oi please do not remove me abusing other wikipedians dickhead oi please do not remove me abusing other wikipedians dickhead oi please do not remove me abusing other wikipedians dickhead oi please do not remove me abusing other wikipedians dickhead oi please do not remove me abusing other wikipedians dickhead oi please do not remove me abusing other wikipedians dickhead oi please do not remove me abusing other wikipedians dickhead oi please do not remove me abusing other wikipedians dickhead oi please do not remove me abusing other wikipedians dickhead oi please do not remove me abusing other wikipedians dickhead oi please do not remove me abusing other wikipedians dickhead oi please do not remove me abusing other wikipedians dickhead oi please do not remove me abusing other wikipedians dickhead oi please do not remove me abusing other wikipedians dickhead oi please do not remove me abusing other wikipedians dickhead oi please do not remove me abusing other wikipedians dickhead oi please do not remove me abusing other wikipedians dickhead oi please do not remove me abusing other wikipedians dickhead oi please do not remove me abusing other wikipedians dickhead oi please do not remove me abusing other wikipedians dickhead oi please do not remove me abusing other wikipedians dickhead oi please do not remove me abusing other wikipedians dickhead oi please do not remove me abusing other wikipedians dickhead oi please do not remove me abusing other wikipedians dickhead oi please do not remove me abusing other wikipedians dickhead oi please do not remove me abusing other wikipedians dickhead oi please do not remove me abusing other wikipedians dickhead oi please do not remove me abusing other wikipedians dickhead oi please do not remove me abusing other wikipedians dickhead oi please do not remove me abusing other wikipedians dickhead oi please do not remove me abusing other wikipedians dickhead oi please do not remove me abusing other wikipedians dickhead oi please do not remove me abusing other wikipedians dickhead oi please do not remove me abusing other wikipedians dickhead oi please do not remove me abusing other wikipedians dickhead oi please do not remove me abusing other wikipedians dickhead oi please do not remove me abusing other wikipedians dickhead oi please do not remove me abusing other wikipedians dickhead oi please do not remove me abusing other wikipedians dickhead oi please do not remove me abusing other wikipedians dickhead oi please do not remove me abusing other wikipedians dickhead oi please do not remove me abusing other wikipedians dickhead oi please do not remove me abusing other wikipedians dickhead oi please do not remove me abusing other wikipedians dickhead oi please do not remove me abusing other wikipedians dickhead oi please do not remove me abusing other wikipedians dickhead oi please do not remove me abusing other wikipedians dickhead oi please do not remove me abusing other wikipedians dickhead oi please do not remove me abusing other wikipedians dickhead oi please do not remove me abusing other wikipedians dickhead oi please do not remove me abusing other wikipedians dickhead oi please do not remove me abusing other wikipedians dickhead oi please do not remove me abusing other wikipedians dickhead oi please do not remove me abusing other wikipedians dickhead oi please do not remove me abusing other wikipedians dickhead oi please do not remove me abusing other wikipedians dickhead oi please do not remove me abusing other wikipedians dickhead oi please do not remove me abusing other wikipedians dickhead oi please do not remove me abusing other wikipedians dickhead oi please do not remove me abusing other wikipedians dickhead oi please do not remove me abusing other wikipedians dickhead oi please do not remove me abusing other wikipedians dickhead oi please do not remove me abusing other wikipedians dickhead oi please do not remove me abusing other wikipedians dickhead oi please do not remove me abusing other wikipedians dickhead oi please do not remove me abusing other wikipedians dickhead oi please do not remove me abusing other wikipedians dickhead oi please do not remove me abusing other wikipedians dickhead oi please do not remove me abusing other wikipedians dickhead oi please do not remove me abusing other wikipedians dickhead oi please do not remove me abusing other wikipedians dickhead oi please do not remove me abusing other wikipedians dickhead oi,0.2123,0.1659,dickhead oi dickhead dickhead abusing
38,that really is the final straw and thoroughly dishonest of you to leave the personal attack to which i was responding,0.0358,0.024,dishonest the is final really
39,you deleted the page unlike 99 9 of other musical artists who don't follow the wikipedia guidelines does they have an album that in the united states and the page i created had a citation confirming this quit wasting people's time and only delete pages that don't follow the wikipedia guidelines if a page meets the guidelines but needs work make it better rather than deleting it all together you're a complete waste of a human being,0.2149,0.1626,you deleted the a a
40,u aint got no mix lady so,0.036,0.0289,no got aint mix lady
41,is this bugs person a particularly troll or just ignorant prejudiced and bigoted see above the section about what the e stands for now where he another remark has he been given a block warning the guy should be ignored is there wp,0.2287,0.1526,ignorant troll a this is
42,this man deserves another shot at becoming a federal judge given all his hard work since coming to america those dirty democrats had no right to about john roberts and sam being two more white guys after what they did to this man i remember reading some complaints by those dirty democrats and liberal latino voters about bush failing nominating a hispanic to the supreme court and i thought to myself well what the hell about you the man received a well qualified rating from the american bar association and yet the democrats him they claim he didn't provide enough information about his views but i think what really bothered them was the fact that he is a conservative hispanic this just goes to show you what those dirty democrats really are whenever blacks and hispanics step out of line by,0.233,0.1492,deserves man this shot another
43,if you continue to vandalize my talk page you will be blocked from living on the earth thank you,0.0428,0.0363,you blocked vandalize if to
44,who died and left you queen of page said he likes vandalism on his page and doesn't want it reverted i'm not sure how many different ways saying it will will be required to get it through your thick skull,0.2149,0.1595,who died queen and of
45,must suffer for his actions,0.0347,0.022,suffer must for his actions
46,this is the bs i am talking about you have lied about me and other editors the murray information was to support 200 fewer if you look at talk page you will see i provided him the murray citation via google books so that is false as well and the same for irving you didn't bother to trace his citation to the sources section did you it reveals the figures for production came from notes if you had also bothered to read the next page p i believe irving demonstrates perfectly clearly what felt about production levels this is part of the reason why you were blocked from editing on the battle of britain page and then again for i am not refusing to give anything in fact i can give you the quote for the 77 only i think i'll do it tomorrow night given i am tired and you having wasted most my time today you should have simply asked for it in the like a normal person instead of moving everything around and removing my citations as for the change in romanian to reich yes it is difficult to work out what is referring to it seems this particular mission was a to the oil plants in w germany not command used an attack by the to attack this target in fact no i can't resist two of 27 were sent up after the but could not get past the of and for the day the force lost 44 16 and 77 fighters the lost no and one so there you have it so now i would like you to,0.0344,0.0158,the is bs this about
47,i know that version of ho came out 3 16 90 but the real release date is this one because came out that day now f off and quit undoing me,0.1901,0.1777,off undoing f quit i
48,yeah what a wicked paid,0.2052,0.1635,wicked paid a what yeah
49,3rr violation of howard stern just about to report you to an admin,0.0542,0.0353,violation stern of 3rr just
50,can you please block me from such ignorant human being as those it would be very appreciated wikipedia is home for offence and ignorance i am sad i quite a lot money to help ignorance to continue its existence i thought should have destroyed i was wrong,0.2294,0.1429,ignorant you human block can
51,harassment i'm getting some serious harassment from warriors we should gang up together like those 2 then go page to page applying our version of wouldn't that be fun then tag team revert any opposition then report them to ani then keep on wikipedia to push our own pov,0.053,0.0342,harassment serious harassment some getting
52,24 august 2008 utc you are the troll here are you not be honest 13 33,0.1894,0.1698,troll the are you are
53,is a retard nigger,0.9667,0.9668,retard nigger a is
54,barbaro i left some comments on talk page i think how wikipedia has treated this and the barbaro family was unfair i also noticed that this individual seems to have just tried to edit his name out of those two bogus societies which seems fair to me and wikipedia editors keeps bringing it back it seems like wikipedia's disregard for others is very cruel just my thoughts i also left some comments too on or talk page too excuse me your contribution with adding san was actually not correct i left a comment for you on talk page i think everyone is desperately trying to piece bit in hope that something an article might show up the original version i saw a month ago was just fine and accurate i just had a chance to look at the history of the barbaro family page why was the article listed as the true barbaro family removed that is the one that should be the official barbaro family page it has excellent sources and clearly is structured in a not only a factual way but also a way that the true spirit and soul of the family this that you have replaced it with is why isn't this page flagged under construction you gotta be kidding me if this is the official article that is constructed for the great barbaro family please say it isn't so this has got to be the worst article i have ever seen on wikipedia this thing usually articles this are flagged as stubs asking for people to expand on them i think it is time to admit that you are out of your league clearly the person that constructed the former barbaro family article was an art historian that new this family and proper sources well hyper yahoo com is in on the hoax this hyper guy is in on it with two they planned to damage the barbaro family page all long first they started bogus societies which they knew would lead to the family page being destroyed they planned it well used the same company computer which would discredit the input and this hyper guy stayed out from editing so he would seem clean but how come the conversation on the secret society talk page is only between and hyper even his tag looks suspicious hyper watch this guy very closely i think the barbaro family needs an i'm sorry because i noticed that whenever it seems like the barbaro page was going to be restored than all of a sudden hyper jumped in with hoax hoax very and well hyper i see what is going on how can anyone discredit all of the evidence that was given in the family i get you hyper you were the straight man and played the opposite role but you are both as guilty without any doubt this guy just comes across an ebay purchase out of the blue from ebay back records yeah right ok hyper excuse me the tie is with the of as said in the proper source listed previously your bogus of history will not be and you will be reported to wikipedia,0.0325,0.0154,unfair some cruel i left
