,comment,aggression,attack,attn_words
96,yes that's because this article is basically the whole races don't exist omg bullshit that in non scientific circles sociology is not a science,0.1999,0.1304,bullshit omg because yes this
97,you're classic only in your world could not being constitute a personal attack d,0.1915,0.1358,you're classic world your only
98,oh and this is a university computer so i dont give a if you block this ip address have a terrible day,0.1979,0.1312,a a is a and
99,she really will not be happy she will hunt you down and post you to iraq in very small i am actually a very funny person but humour doesn't travel well in i still think you should be struck off for wessely though to say that is my right freedom of speech etc you could say i am going to write to my mp and request that children aren't by being copies of why was wrong blocked my isp is randomly assigned so i can't see how that works you really need to grow up i think i pop into wikipedia the odd time to make the odd edit only to be faced with a pompous now i think is just one big,0.2035,0.1274,she down will really and
100,hello place the following in the large text box why do you like to girls don’t you know that’s a,0.1751,0.145,don’t girls hello a place
101,you just can't get over it seriously i never even know when i was banned i assume it was in september with but can you ever forgive me or will i be your mortal for all look at and they were because they were supposed to but they got over it 'cause saved do you want me to save you from a bear like did or something by now if you're willing to forgive i'm willing to forgive but that will never happen because you learn from please,0.2093,0.1202,just you over seriously get
102,80 billion clean technology program has begun to look like a political for an administration about to enter a campaign whats 80 billion among political friends but i guess only brain dead would care if 80 billion is by political friends of barry o,0.0251,0.0168,80 billion clean political a
103,and this page has obviously been by someone who is not familiar and hostile with numerous opinions stated as fact and arguments added as far as controversial subjects are concerned wikipedia is ruined really isn't it,0.0242,0.0167,obviously this and has page
104,get a life loser get a life loser,0.9744,0.9761,loser loser a life life
105,my promise to you all is that i'll destroy both google and wikipedia in less than 5 years,0.1871,0.1238,all is destroy my i'll
106,i have noticed you still haven't responded i will file a formal protest since i have done my part of trying to work this out you have no answered my question of how this was harassment please respond or the next message will be to report you,0.0234,0.0146,have i still noticed you
107,hi hi just regarding the recent comment you put on my talk page i am not new to wikipedia i have been editing it for years and the comments i put forward with regards user andy j smith are 100 true and correct thanks for like most other wikipedians who have no life except wikipedia sticking your nose into business that is not of your concern,0.0234,0.0162,just regarding recent the put
108,attention user meters his royal the is very angry he wish for your to be delivered to him on a silver as you are clearly a a squad of royal will soon your pc many kind regards the office of his royal the,0.1704,0.1351,meters his angry a a
109,the whole world knows jesus was an illegitimate son of an unknown man and thats the reason why christians are so backward that they use hindu numerical system,0.023,0.0157,world illegitimate the whole knows
110,okay what a bum,0.1612,0.1403,bum a what okay
111,pete piss off asked a polite question i happen to know a fair bit of the answer so i gave him a polite answer i hope it helps him understand i'm not pretending that i have sources for all of this i'm not asking that it be added to the article i'm sharing knowledge it's something i do reject it if you choose i cannot comprehend why you would but people surprise me every day oh and there's little opinion in my post most of it is pure fact a fact is still a fact whether it's sourced or not,0.1722,0.1291,piss off asked pete polite
112,hey i added a tv reference to the wiki article about frank and said that was name of an episode breaking bad and you auto changed it off i try to help and i get treated like dirt and all the time i spent too,0.0223,0.0129,hey added i a bad
113,if you don't see the or intentional disruption in this page let us wait until some newspaper makes a laughing stock of it,0.022,0.0141,don't you if intentional see
114,what why this is crazy if you look just above i did not even respond to the personal attacks of the guy who came here to called me drama queen and fanboy with a little heart i just told him to stop on his talk page i didn't even report him but maybe now i do okay as you see what now or do you mean the guy who came here accusing me of engaging in sockpuppetry this after i stated i don't care anymore and i even this article and for sure did not edit in any way if so i'm going to his page and say he's engaging in and demand him to stop same in facts probably but i see stupid accusations are perfectly okay just saying they're in fact stupid is a crime of some sort if none of these then i just have no idea category requests for unblock,0.1974,0.1089,crazy what is this you
115,yeah why beat around the bush why your racist views everyone can see where you're coming from just blank the page again with 'fuck israel as brief and clear as that ',0.164,0.1303,racist beat the around why
116,i was blocked for 24 hours it even been 24 hours i havent been unblocked so how could i insult someone when i cant even edit a page stop being a,0.0217,0.0157,blocked was i for 24
117,i've had enough get the f ing dvd of it mentions of the back of d dvd guide that is coming to dvd and blu ray spring 2010 i'm going to say this once and i'm not going to say this again in fact go ask he knows it's true,0.1524,0.1378,ing f the enough get
118,why did you take sides it was 10 against one you know that source is pov and completely biased and did not belong there i know you do i am very very that you would do that alas a sad day for all people of who protected and lived with armenians for centuries you have no idea the damage you have caused for people of especially the armenians that live there they will probably go the way of some nationalist will read your false accusations you have no idea whatsoever i'm truly amazed at your ignorance i gave you guys too much credit have a nice life and when some poor armenian gets blown away by a jackass turkish nationalist after reading you b s about you are responsible solely you and you only have nice life,0.1944,0.1052,you why ignorance take against
119,you're wrong us law would not apply in this case you're obviously not a lawyer so don't pretend that you are you don't even play one on tv,0.158,0.1275,you're wrong us you're obviously
120,rock alternative what is your problem alternative rock like a to the ignorant people who put this genre do you even know what alternative rock is how can you label him as alternative rock the latest album might have some elements of it but him is not an alternative rock band they have gothic rock elements metal elements rock elements and much more they are love metal,0.0202,0.0139,ignorant alternative what alternative is
121,we did about an hour ago and i suspect you and i would agree about most editing matters the only points where we disagree involve how to treat other people and the usefulness of up shit you seem to think that you can at people and have some positive effect in the world by doing it and i know that to be false you once tried to set my hat on straight by talking to me like i was dirt that was neither smart nor useful nor effective i mean unless you think that your feelings is a valid use of wikipedia's servers it's not that's all though we probably agree about most other things i'll never open an rfc u on you or anyone else and i have no desire to do so if you think otherwise it's because you believe you know things that you just don't know you're dishonest and emotionally a child now leave my talk page,0.1951,0.1013,shit we did about an
122,you've been harsh with it no need leads often don't have sources your being rather you are the person ever if you cannot read what is or understand basic words such as in a sporting context and thus shouldn't be doing ever level 2 english exactly why you shouldn't be commenting on and gee this is why the english wiki is so shit what's going on i asked you to explain your objections a couple of days ago to moving pictures in the eagle article but you haven't i see you have also been asked above to review something but you haven't done that either in the meantime you have found time to a of other and at the top of this page you have a box which says if you want to ask me something please do that so you seem to have ignored everything and going on,0.1646,0.1187,harsh you've shit been no
123,communists all communists should be shot as starting with you,0.1525,0.1281,communists communists all shot with
124,this page is a shame you are not showing respect for wikipedia,0.1636,0.1193,a shame is this are
125,i've great respect for i don't however have any respect whatsoever for the preposterous not to say idiotic rules and policies of wp that and that alone makes me for editing any wp article whatsoever i also think that it is those very rules and policies that any integrity a so called minority view article could ever have the only thing the wp rules and policies have accomplished at the as article is to prevent useful important and thoroughly verified information to be included at the same time irrelevant and factually false claims have been and all through the article there is no integrity there very little informative value and a high degree of distortion if that is the wp idea of integrity then that is an integrity not worth protecting and isn't wp supposed to the free and public encyclopedia if that is the case why should we be bound by any from jimmy wales we are the editors not him he may have founded it but we are the ones it by the logic employed by some editors here the government should be allowed to have total control of the internet because it was government that created the internet that is the principle wp seems to follow and i reject that principle i also submit that any rule and policy that is so destructive as those employed in editing the as article can and should be altered or,0.0371,0.0199,idiotic great preposterous for respect
126,what makes you think that i care about anything you have to say about or or socks or anything else leave me alone,0.1618,0.1175,you what care makes think
127,i'm violating acceptable use policy report me to do your worst i've already placed my with them there will always be a way around this it's a major flaw in wikipedia figure out a solution so you can get back to your serious work,0.1759,0.1077,worst i'm violating a a
128,i'll be removing attacks from this talk page whenever he posts them and i'll label them as the pathetic they are cheers,0.1533,0.1231,pathetic i'll removing be attacks
129,like i said nothing you wrote at wikipedia sockpuppet investigations provides any evidence of being connected to either or i'm starting to believe that this is some kind of personal attack against and i'm warning you not to use the spi process for attacking other users without evidence,0.0189,0.01,nothing like i said you
130,kudos for destroying article copyright you really deserve nobel prize for copyright,0.0187,0.0117,deserve for really destroying article
131,appear to be uninformed and i am afraid you come across as rather ill as a result i suggest you re read this page and try to properly the useful advice it offers rather than simply mocking it because you don't understand it,0.0182,0.0097,uninformed appear and be to
132,drop dead i'm not gonna bother with you wait till my dad comes,0.1485,0.1212,drop dead i'm with you
133,secular best friend i know you guys want to bow before your islamic masters but you need to calm down allah is with atheists and perhaps the muslims will hang you last if you support their want of death to atheism,0.1646,0.1092,bow secular guys to your
134,re edit warring first off i am well aware of policy as is the case with you self any most admins you fail to to have done your fully or to find out exactly what is going on but instead have decided to the and policy of which for an encyclopedia is unacceptable as for the action i do take them as vandalism under the of childish vandalism in edits only are to remove articles from categories thus blanking them and attention seeking vandalism in to seek to bring attention by other pov warriors to join his side as well as redirect vandalism the user has now since decided to edit under an anon  •  in which he has used edit to to his vandalism all of which i have reverted now i see the and of misleading information in of the facts that have been presented to the user to be vandalism i will treat them as vandalism and if you see fit to me then so be it but be sure that after the block has expired if that it is still misleading and i will change it i am not here to make friends or to have wikilove or be part of community experiment that you i am here to present information,0.0414,0.0187,off unacceptable admins most any
135,can you email me use an anon account this bias here is overwhelming and the just ban all dissent how utterly nazi he is running to the now to get me banned how ironic that he complains about how his parents were and he does the same thing truly unbelievable,0.1617,0.1106,you can nazi an email
136,yet you leave walmart facts remain while removing a link to the files area which contains saved copies of actual news stories yeah you're really against walmart and why should i bother creating an account when this place is over run with biased who claim anything they don't like is vandalism or pov btw you and the other's have been added to an online list which includes urls to other sites you're a part of,0.0312,0.0184,leave yet you walmart biased
137,go away don't use my again for any reason or you will regret it,0.1619,0.1092,away go don't use again
138,what the fuck is this,0.9848,0.9821,fuck is this the what
139,is biased against league schools because he she probably got rejected from one,0.0177,0.0112,biased against is schools league
140,dont touch my edits you anti,0.1468,0.118,touch anti you my dont
141,why it is so much fun pointing at the this wiki stuff is just of the kind and i no longer care about being blocked anyway,0.0174,0.0125,why is so fun it
142,jeremy jeremy criminals like you their tongue when the roles revert just wait,0.1423,0.1208,tongue criminals their you jeremy
143,it does not matter if you torture and murder people use or both both shut up the opponent in order you to prevail do not try to present it otherwise,0.1571,0.1092,shut murder torture it you
144,thank god or we might still hear more of his crap,0.1623,0.1045,crap of more his god
145,i am getting seriously pissed off dont revert my edits again ok do you get that in your head or do i need to it in,0.1568,0.108,off seriously i head am
146,blind as not one of you has seen what i have done to this page obviously you rely on some form of program to revert vandalism and not your own eyes,0.1502,0.1106,blind as has you of
147,this latter site is obviously a front for pakistani terrorists,0.0167,0.0109,obviously this a front is
148,go back to pakistan you're not wanted here,0.1291,0.1265,you're go back to pakistan
149,sexy time with old,0.1354,0.1197,sexy time with old
150,style border 1px solid gray background color rowspan 2 valign middle rowspan 2 style font size large padding 0 vertical align middle height 1 1em the for being a complete tool style vertical align middle border top 1px solid gray i award you the for being a complete tool for your bad faith edits and nomination for speedy deletion of the article chris your arrogance and lack of community awareness demonstrates true wiki courage note this is not a barnstar a hat – tim the tool man taylor,0.1439,0.1119,style border arrogance 1em a
151,i reckon i stand behind fred would never stand behind or in front of as he is homophobic,0.1444,0.11,reckon stand i behind i
152,is an arab why are people lying it is not an italy thank you very much,0.016,0.0117,arab an is are lying
153,5 may 2013 utc so if i register the user name or that s cool in your book since i could mean i have a massive hatred for or want to burn all sticks and so that s ok what about e g i like sticks to increase there for the purpose of selling them with much etc 12 47,0.0157,0.0094,5 so massive may hatred
154,1 you be there is no force in islam and was he was from bosnia and was does not mean serb 2 so you claim there were no bosniaks before 1993 are you a serb nationalist perhaps bosniaks were in the middle ages then in the ottoman empire then they became just muslims and then again 4 real bosniaks and was one 3 did not exist in bosnia before 1918 4 bosnian serbs are bosniaks who there orthodox started seeing them as serbs in the 19th century 5 i am the best you can do go and rest,0.0156,0.0108,1 you there no be
155,questions about your biased edits to australian politics wikipedia articles hello i'm from the university of sydney and i would like to review you as a political you were mentioned in one of our lectures as an contributor to australian politics in wikipedia clearly you have gone through some experience in life which has led to your extreme bias and left edits the need for power and your nature were you sexually abused by your father did he physically abuse you if you are interested in this survey please email,0.1444,0.1056,abused biased sexually your abuse
156,this editor thinks not there is a dispute on the table here vs non concerns self vs non self concerns individual v social concerns libertarianism is a celebration of the ego isn't it and by ego i mean self from the self comes liberty from the ego comes identity socialism that seems to me to be all about the non ego freedom itself is derived from man i know we're just a democratic encyclopedia and are prohibited from doing original research but seriously guys wake up are socialists isn't that like the opposite of libertarianism i for one am not a big fan of submitting to the needs of the state or the people from socialism i see comes anarchism the of behavior amongst humans the of a authority if there is no authority who controls the state of things a dictator that's who take north korea for example or the former ussr or nazi germany all of these states are self proclaimed socialists are socialists i think not thomas jefferson again guys girls i'm just making an appeal to logic not authority this particular wikipedia article a thoughts please do not remove this writing i will re establish it i am simply trying to create a dialogue does libertarianism have anything to do with socialism because socialism it seems for anarchy and anarchy as it were is a pre for dictatorship are the opposite of we are individuals socialists are non individuals speaking there is a tremendous amount of confusion and out of this confusion comes leaders i am an but i do not believe in anarchy does that make any sense if the majority disagrees with me so be it but do not delete this post i would like to hear some thoughts carol don't even think about it are we advocates of logic truth or opinion,0.0153,0.0081,this thinks editor non socialists
157,hey look who's another xbox fanboy david how did you came here are you reading my edit log as do aka,0.0221,0.0155,look hey who's fanboy xbox
158,stop being so dramatic,0.0153,0.0109,stop being so dramatic
159,ok stop being lame seriously go watch pokemon,0.1347,0.1112,lame stop seriously being ok
160,okay basic english a bad faith accusation would be one that the person who made the accusation did not actually believe a good faith accusation is one that the actually believes i actually believed my accusation or actually not even that i simply asked for someone to look into it in either case it was a good faith accusation since you clearly do not understand the difference between and what those terms are and how they are used you need to your claims to any credibility in wikipedia why don't you search the term you'll see i am right and your paragraph above is on not knowing the meaning of the term i did not make a bad faith accusation i was acting in good faith you have been making false accusations against me saying i am acting in bad faith when i did not what are you going to do to correct your error god only knows what you have been creating in wikipedia with your slim grasp of terms if you can't get the first principle right,0.0149,0.0056,bad basic a english faith
161,http en wikipedia org wiki user talk 62 174 what the fu are you talking about if you had an of reason in your you would have seen that i just removed a double entry nothing else by the way there is more of it further down on that page but i from doing that as i am not a native speaker it is people like you that make life hell for ordinary wikipedians,0.147,0.101,http 174 hell an life
162,the extent of your homophobic ignorance is genuinely it has been clear from the that you have no contact with the academic world but even informed are aware that queer studies is a standard term for scholarly programs at many universities and that queer is a term of choice by many individuals with same sex lifestyle preferences your preposterous statement that gay encyclopedias are not considered an authoritative source here is simply laughable your personal and are your own problem jack and are not a basis for censoring this article if you have an issue with the encyclopedia as a source you should deal with it at the relevant wikipedia article com i have once again restored the sexuality section if you it again i will refer your homophobic vandalism to wikipedia's lgbt project,0.1563,0.0943,homophobic ignorance your the gay
163,please keep your insult to yourself please keep your insults to yourself i suggest you spend your time finding out where companies keep their retained profits as you have told me in the past here on wikipedia that they keep it in the bank what nonsense and then you say you have a phd in economics from harvard please keep your insults to yourself,0.1577,0.0934,insult your to keep yourself
164,you me,0.132,0.1114,you me
165,not for russian socks like,0.0146,0.0118,for russian not socks like
166,what is happening here clearly is is attempting to obscure that past which brings him the greatest and he to do that through the addition of of irrelevant material that is purely self promoting rubbish we know this because he did it before to the point where his wiki profile read like a fantasy novel and he was prince mr is a career and was red handed by the sec that is his claim to fame nothing else is relevant certainly not his biblical promotional materials,0.0144,0.0071,what is happening here clearly
167,plus i think this guy is a p e n i s,0.1191,0.1201,a p guy is n
168,bryan is the worst ride operator at he has attention disorder and he acts like a know it all,0.1368,0.1045,worst the is disorder bryan
169,go on have me blocked it won't change anything you're a and a wp game,0.1258,0.1121,go you're blocked on have
170,is he is the dude in the world,0.1284,0.109,is he is the dude
171,did you read his transcripts he's as much a racist as the grand wizard of the klan,0.1333,0.1048,racist you he's a his
172,note to wiki nazis um why did you delete the lists of features take a look at the other content management entries on wikipedia like and you'll see this is common practice and don't worry i plan on adding the third party citations you so require kill a guy for trying to contribute to wikipedia why,0.1498,0.0923,nazis um wiki note to
173,maybe you haven't received any education the answer is 800,0.0137,0.0112,maybe haven't you received any
174,still here what is it like up every morning looking at the mirror girls cross the street at your approach who laugh as you attempt to down the street what is it like to see sexy women in at your approach what is it like to eat 15 chocolate bars in one sitting what is it like to be what is it like to be an dick along with all of that who does counter productive things even though a bit of common sense 16 months ago would have saved him all this what is it like being that edit perhaps you should consider a dialogue all this reverting is so its silly i've said it before all you need to do is offer a recognition in an edit summary that i fucking exist you fucking moron and i will go away for ever moron,0.1471,0.0914,still dick here is what
175,again you don't decide what npov means when you assert that your position is the only one that to wikipedia policies against consensus it's very disruptive furthermore the viewpoint that life on earth came from matter by generation and evolved solely by natural selection to its present state without planning from a designer is far and away the minority viewpoint if we really followed npov we wouldn't mention the fringe viewpoints of a slight majority of scientists and instead focus on the clear consensus among the public religious leaders and a strong minority of scientists that life on earth was designed are you simply ignoring this,0.0134,0.0062,again don't you decide disruptive
176,banned you are banned from wikipedia you're no longer welcome here what part of wp ban do you not understand edits by banned vandals such as yourself are to be removed at once,0.1231,0.1076,you're are you banned banned
177,hey dead set,0.1192,0.1102,dead hey set
