,comment,aggression,attack,attn_words
390,diff hist 21 45 37 talk contribs ‎ rv defined as a controversy source for that definition please well what do you know came this all knowledgeable called modifying facts about a 3000 years old written history nation if wikipedia means just frustrated and like this guy then i'm out of here no wonder why academia considers wikipedia a non trash it's all about you guys,0.0323,0.0246,45 nation 37 21 non
391,art i used their offical website as help to al information right therefore some sentences were left but also other material was put in meaning it isn't again copyright law as this is my own work via help from the band and metal archives aka i put them together meaning they have different copyright laws to their biography even if they do than this one here so if anyone wants to help delete some and put it in wikipedia's own words your welcome but it took me 2 hours to read through information to do this and if it gets deleted i will be mad,0.0008,0.0004,art used welcome i sentences
392,look the question doesn't help i'll ask again must we supply citations that the easter rising happened in just because you don't happen to know doesn't make it not widely known please don't be cowardly and answer this question,0.0331,0.0214,cowardly the look question help
393,alex why did you delete the page you st,0.029,0.0234,why alex the delete did
394,i was right you,0.0286,0.0235,was i right you
395,declaration of war against vandalism on articles this war started at the article i was very long time for anyone to this article god is our clan god and i want to give complete information about god on wikipedia this article was created and i was very happy but suddenly just in seconds this article was created this two guy started vandalising it by wiki rules it was very clear that their intention was very bad and first i warned them in good legal language but they don't listen to me and went further and started vandalising other we can bear personal but not on our gods and anymore so i request all brothers that they start to take strong action this peoples entities all we know that this people are and peoples of india they have not participated the freedom struggle of india nor the deserve to call an indian they are pure bread of our nation and hindu aryan religion so we should all gathered and fight against them,0.0361,0.0185,war against of vandalising vandalism
396,me big time,0.0278,0.0239,big me time
397,first and there is not and never has been any wikistalking this is paranoia on part and has been present in numerous remarks he has made not just those dealing with reverting i do find it however that he has to claim wikistalking yet he has a history of reverting an article in an edit war but trying to claim he is in no violation of a 3rr rule as a result of his changing non vandalism second of all i did not attack his talk page you may go and see the history of the page if you wish to verify this but all i did was make a comment that was not in agreement with what he said because he me and because of his paranoia and possibly because of other reasons which i won't go into because he'd just cry about personal attacks he removed the comments i made all because they didn't go with what he said and believed this was immature childish and stupid at best but as i said on another page if he wants to look that way who am i to stop him then there is this appeared as another blah blah blah as soon as blah blah blah isn't this funny or what he has to go and request a checkuser because he can't tell who is who yet he has no problem pulling out the sockpuppet accusation and it around like a at a rodeo of course there's no way chad could ever be despite evidence pointing towards him for it would be for someone to directly accuse him of the same behavior of which he so loves to accuse others made allegations of stalking to paint himself as a victim did chad even read what he wrote did he realize that he claims i made allegations of stalking to paint myself as a victim yet in the same remarks he claims wikistalking on himself i mean you just gotta laugh sometimes at these things you know but being a hypocrite is nothing new to him as for the attacking of the external link he still has no proof i am that person who he claims that i am this is the same he got into with and how fucking funny is it for him to claim i am that person yet three paragraphs later he has to go and claim a checkuser you get the idea i hope think this is stupid but when you are dealing with you have to expect that,0.0361,0.0179,and first wikistalking there is
398,from definition holocaust denial is the claim that the mainstream historical version of the holocaust is either highly exaggerated or completely and his have claimed repeatedly that the mainstream historical version of holocaust history being covered in this article on the new york times and the is false or exaggerated and they have denied including facts figures and quotes from the new york times itself from the directors of the holocaust museum and the center for holocaust studies you may disagree with my use of this term but it is a use about which reasonable people may differ i am not going to apologize for using it the apology is to me for being abused for speaking out for the truth about holocaust history the fact that admits he has been called a holocaust denier before should be an absolute red flag this is not an accusation people make for no reason i have too much respect for holocaust history to do that something the administrators at wiki evidently lack you should all be ashamed of yourselves this is a scandal,0.0006,0.0003,definition exaggerated reasonable exaggerated from
399,hey i am back,0.0294,0.0214,i am hey back
400,not at all it's my talkpage and you have now twice deleted my own comments block me and you'll be at arbcom remember,0.0266,0.0231,not all have twice own
401,it's not tim dummy,0.0263,0.0223,not it's tim dummy
402,already told me god jesus,0.03,0.0194,already told me god jesus
403,unblock me you unblock hahahaha one of my favorite and most memories was of a party i attended in high school it was near the end of the year and everyone was letting loose the party had not gotten too badly out of control and was finally down i was dating at the time we'd been going out for about six months we knew our time together was growing short since we'd soon be heading off to college she to and i to hopkins we were taking every chance we could to be intimate i'd been with a few girls before but had been my first long term intimate relationship and we'd taught each other lots the party was at house and we were helping him clean up there were only six of us left and i keith his girlfriend linda tom and his girlfriend sue linda lived just a few doors down and had invited and sue to spend the night tom was going to spend the night at house conveniently parents were out of town until tomorrow so nobody really had anywhere they had to go and once we'd done a fair job of cleaning up we are able to sit back and relax keith was my best friend we had a lot in common even if we were a bit of a and jeff in appearance both of us tall i had a wide body result of my hawaiian ancestry while he was lean and i'm but he had a good 2 inches on me and had long hair past his shoulders mine is brown and and usually just goes it wants i'm strong as an he's lean and fast but we had similar taste in women on more than one occasion i him that there was no way he deserved to be with linda our high school and he was extremely that i had our big sexy as my partner and sue were close friends if we'd had here the would have been complete they had all been until that year was dating and told me that she and ryan were doing everything except the final act hadn't done much of anything until we'd gotten together but we didn't let grass grow under us and we made up for a lot of lost time we'd had sex plenty and sucked me off more times than i can count i'd even fucked her incredible a couple of times sue it turns out was the late she was still an innocent according to kissing was as far as gone although it seems dick through his pants and he'd had his hands on her even if the was still in the way but was that this party might be lucky night we were joking about some of the antics that had been going on at the party linda in particular was a sit back and watch all the activities at the party and was always good for a few there were some really desperate people here tonight she said can you believe gary tried to get a game of spin the bottle going i can't say i really blame him i answered with a not every guy there is as as us to have such or any girlfriend for that matter hell i mind playing it now that earned me a in the from sue in why is it that every party ends up with some lame guy trying to start some stupid game like spin the bottle post office or strip poker now that's a stupid question keith answered and why is that linda asked isn't it obvious keith replied no linda and sue answered in do you want to tell them keith asked me with a so i explained the obvious because they are desperate and sometimes it works oh please said keith was a real you guys have never played spin the bottle the girls looked at each other maybe a few times but certainly not in the last year linda finally answered and how about truth or dare keith continued them on well sure but usually only with people we know really well answered this time usually keith with a and it's not like you've never played strip poker the girls looked at each other quietly no one answering oh come on i i know you've played strip poker not really i watched part of a game but then they everyone not playing out of the room why i suppose you've played it she asked with a dangerous tone in her voice sort of in camp we started a game but it got before we got anywhere i drawing a laugh from the guys laugh it up go ahead have you guys played it to that shut them up i'll get the cards linda said what sue almost out of her chair her moments later if gossip was to be believed sue had never done more than not even a hand job for poor troubles i wasn't surprised that she was against the idea come on linda we can't possibly graduate high school and never have played strip poker and if you were ever going to play can you think of a better crowd to play it with she had a point there we were all good friends and nobody in this group would look bad in the we'd all seen each other in pretty as it was and most of us had seen at least one other plus we could all keep a confidence within the group keith was about to say something and i kicked him hard he looked at me and i my head i wanted to grab him by the and him let the girls talk each other into it and we stood a pretty good chance but if we acted like we wanted this we'd be shot down in moments this gave me an idea it's pretty late anyway and it could get a little awkward i said now tom was looking at me jack don't you want to finish your camp game we're not going to bite her words with a on my shoulder no you guys can't back down now linda insisted so maybe you and i can play our own game keith told linda getting the feel of where i was going hell just get the cards linda sue finally spoke up they'll play or we'll just go home i couldn't believe it the most likely to this game getting off the ground had just threatened to leave if we didn't play we sat around dinner table at hand while i the cards how do we play i asked how did you play last time at camp sue asked her words were a bit she was still drinking and was by far the person present come to think of it i'd never seen her drunk i guess there's a first time for everything maybe a couple of for sue tonight we played straight poker and the winner could choose one person to remove an item i told them how did that work tom asked not really good we had five girls and two guys we had into their side of camp and we were losing badly i admitted how did they play the game you were watching i asked it was crazy all the losers lost clothing in like three hands everyone was half naked she told us linda laughed we're not playing that one we could play with chips and have to buy new chips with clothing tom suggested too complicated linda answered how about 5 card draw and the lowest hand loses an item tom offered keith spoke up there's really no to win all you care is that you don't lose no that might work i said offering up my two cents how about this we play 5 card draw with the loser removing one item also the winner can make one other person remove an item or drink a shot their choice i watched them that one a little faster a little more and more to win plus you couldn't pick on one person too badly i like it linda finally said me too added and soon we were all agreeing to play strip and poker so deal 'em up keith said one second it was sue she wasn't backing down was she how many items does everybody have we had to agree that shoes could be counted individually and socks were counted as one item we all had between 3 and 7 items so the stripped down to six and we gave linda who didn't know where her shoes were and wasn't wearing socks a hat and my shirt i had a t shirt to go with her dress and and we agreed to count her watch we were almost ready to begin keith what do you have for shots tom asked and he answered looking in his bar he pulled out the and we better stick to these the is almost empty and they might notice if we clean 'em out the other were huge and only a third empty so we probably wouldn't get we still had beer outside if it came down to it once we had played about half a dozen hands it became clear that tom sue and linda didn't know much about playing poker they lost 2,0.0312,0.0183,me hahahaha unblock you of
404,thanks your dog is just the right size for,0.0252,0.0226,dog is just the your
405,please block my block or i will put a virus into wikipedia,0.0295,0.0189,block or block please a
406,this is so funny here talking about methods encouraged by wikipedia your tricks are out find some other place to vandalize,0.0294,0.0185,is this so funny here
407,i know it's england because it says utc in fact i'll blow up uk and ireland,0.0279,0.0189,blow i england know because
408,my edits i yours thats fair aint it,0.0274,0.0188,fair thats edits i yours
409,welcome korean page why don't you enjoy korean le,0.0244,0.0198,welcome korean why enjoy korean
410,led you cant trace me,0.0242,0.0191,led you cant me trace
411,i was because i am inexperienced and was the hostile editor i am dealing with deleted the entire article and a inaccurate stub the rules of wiki are and not at all user friendly they are easy to misunderstand for a and easy to manipulate maliciously by an experienced wikipedian like from my reading of the definition of vandalism i thought deleting the entire article was against the rules and my putting it back with minor changes was completely legal he basically me into a revert war he was not punished but i was not just but banned and told i must get consensus to make any further changes since then the article has been frozen your other advice would be useful if this was an ordinary dispute with well meaning people who disagree or if the topic was indeed trivial it is not appropriate to walk away from an article on the holocaust because there are malicious and hostile editors who want to the record or what is happening here ban basic facts on the holocaust this is not a topic where it is acceptable to let the bad guys win for me is it okay with wiki administrators i don't think it is appropriate to use mediation with what are holocaust deniers this has been going on for six months posts asking for consensus are ignored any post they see as a challenge is answered within minutes i did walk away for several months and more recently for days at a time and there is no relief there has to be another level of getting help at wiki for truly problems like unreasonable malicious attacks on holocaust information not taking sides or even knowing the topic of the dispute is fine when the dispute is between two sincere editors but what if the dispute is about non controversial holocaust history and editors who have dedicated themselves to keep it out of wiki and also to drive sincere editors off the page if not to discourage them from ever participating in wiki again this is much bigger than my individual problem or this one article this is a wiki problem of how to deal with malicious spoilers,0.0336,0.0136,i was inexperienced because hostile
412,that clearly states its an essay not a guideline and sorry don't hold water if its crap then take it out of article as well don't be suddenly its not allowed here but it is there,0.0275,0.0163,crap clearly states that its
413,useful advice have you ever thought of going to a to help cure your the last thing you should be thinking of is becoming an holy smoke,0.0265,0.0167,ever a the of you
414,we arab,0.0251,0.0171,we arab
415,explanation for the above nonsense please please check the banner at the top of the page you that just posted this comment on not a controversial subject are you really serious in putting forth or defending such a ridiculous position that is laughable,0.0278,0.015,nonsense ridiculous for serious explanation
416,he's not a retired he was just useless,0.0232,0.0179,a retired he's not he
417,respond to our comments noob,0.0257,0.0158,our respond to comments noob
418,give me proof,0.0241,0.0168,give me proof
419,user there is no reason to be that rude why would anyone in their right mind unblock continue to misuse the unblock tag for frivolous unblock requests and you'll lose the ability to edit your talk page you do not know me personally to be that rude what you said could have been stated in a much nicer manner such as please do not abuse the unblock request or i will be forced too take action there is no need for you too be that rude regardless off what i may have done you as an administrator should maintain some sort you do not know if i am older than you or younger than you i am new too wikipedia so please stop being mean the attacked me first with words such as muslims of and words such as f so next time try to show some read what i have too say above please i only put the unblock request back up so you would come read what i have written in response to what you said to me before,0.0311,0.0124,rude no there is user
420,2010 utc well thanks for your welcome but as a matter of fact i don't like this place and i'm sick and tired of being a wikipedian specifically i'm sick and tired of the political correctness and far left bias prevalent in this place that even common sense and factual accuracy for example a while ago i was reverted and down for calling muhammad a child which he was on the war on terrorism page someone recently deleted all mention of the fort hood massacre as a terrorist attack despite evidence of terrorist involvement and just a couple weeks ago deleted all mention of the soviet in the article through labor also deleting a whole bunch of sourced and referenced claims by me and others and i got blocked for two days for trying to restore this info as a matter of fact i'm seriously starting my own wikipedia to counter those biases and steal your audience well i'm done my rage here fuck wikipedia and goodbye 03 44 9 july,0.0275,0.0139,sick sick fact welcome of
421,no i know where he was buried close to the i all over his grave anyone know where his ancestors are buried i would like to dig up their graves too,0.0227,0.0159,no i know where he
422,is apparently still incapable of distinguishing between a collaborative project and a personal blog '''',0.0229,0.0154,incapable still apparently is of
423,alert so is your real name not or or,0.0205,0.017,real your is so alert
424,ocean in the end michael himself while over his dead body,0.021,0.0161,the end in ocean michael
425,my organ meat is and it makes a fine i assure you my is considered if you will please it all then you may your own needs and your own curry thank you please,0.0205,0.015,a is my and fine
426,you to photos of ronald reagan don't you did you know his birthday is a national holiday in iran no one did more for the islamic revolution or the taliban for that matter than reagan,0.0208,0.0146,to you of photos ronald
427,i think a,0.0194,0.0139,think i a
428,did it's called books and websites external and also pictures again it is a failure on your part and wiki to notice wiki is a failure at getting real information to the world you people are too too controlled by mass media it makes me wonder if the oil industry is behind your funding or maybe it's the church whatever the case you can't support anything outside the norm good bye,0.0235,0.0115,did failure a failure it's
429,further comment me out of the cfd during one of its last days falls in the unfair category especially given that it was clearly agf in motivation to start with despite all claims of uninvolved and innocence this is politics and in politics is everything and hostility towards and contempt for me is a well established fact this is in the same kind of as the she closed during the block she imposed have you people no shame i know you don't have self critical examination skills that's for sure or you'd see the of your action and recognize that the cfd itself was an npa,0.0209,0.0127,unfair further contempt imposed no
430,wow this page is so awful it has some decent information but it looks like a 12 year old wrote a c grade essay i'd like to get some people to help me fix it up,0.0225,0.0116,awful so is this page
431,says the with a personal agenda,0.0173,0.0134,the says with a personal
432,you talking make a constructive proposal and we can talk about it but don't give me this nonsense,0.0192,0.012,make talking you constructive proposal
433,you quickly forget that i am objecting to the of a and the of a or do you not concede that a valid proper rule can be and or merely citing the rule is pointless when the problem is the or of the rule further dodo violated wp rules by not allowing a consensus of the group to develop he also a rule claiming that something i said must be but what does it mean to be dodo implied that what i said must be scientifically true i claim quite to the contrary that since the article involved is subject me that the only issue is this did actually make these claims or and someone else his identity etc for example there was no need to rush and delete my posts rather somebody preferably one familiar with logic could have said bell how do we know that q is in fact the james bell who is the subject of the wp article we need to be able to verify the fact that actually said did this to ensure that is not being by a forgery in response i would have immediately said good question and i could have promptly proceeded to do whatever was necessary to establish this fact perhaps i could also have a recent current photograph to the article which of course could be compared with other published even if not public domain photographs which are available on the web but as john was so fond of saying ' rather than help a to wp and wait for a consensus and actually help verify that q is actually dodo decided to be an ass and repeatedly delete my edits and he deleted all my edits not merely some portion which allegedly was not i will give an example to the contrary i also posted a claim that i accused the of forgery in a criminal appeal case 99 in fact in june 2003 i wrote a lawsuit 195 pages which has i believe long been posted on the web probably it as i recall makes exactly this accusation so if dodo had actually acted he would have edited my edit to cite my lawsuit which has been posted for perhaps 5 years or he would have said to me bell you need to show a cite of your lawsuit that would have been productive useful and helpful as opposed to being hostile counterproductive and malicious so why didn't dodo do that the answer is quite simple dodo is hostile counterproductive and malicious he's a apparently wp rather than being supportive and helpful dodo wants to slap around newbies who upset his apple,0.0233,0.0097,quickly forget you pointless that
434,good bye biased administrator,0.0184,0.0124,biased good bye administrator
435,ps karl this not,0.0172,0.013,this karl not ps
436,haha son of a donkey is actually just a for in i'm just confirming that i'm and not as per your repeated allegations that i am someone else after this i don't feel i owe you any apologies,0.0182,0.0116,of donkey is a actually
437,right what you need to understand is that we are equals you are not higher than me in anyway so wind your neck in i went on to that persons talk page thing and edited the deleted my edits k,0.0176,0.0113,what need right equals higher
438,for with a user who is blocked for 1 month and just returned from a 1 week block both for long term abuse,0.0154,0.013,blocked for is who with
439,listen 2 me u alas it is ur name ur character i am ryulong remember me,0.0159,0.0123,2 listen character it am
440,ahh heck why wait comments from harrassing deleted,0.0171,0.011,comments why heck wait ahh
