,comment,aggression,attack,attn_words
261,do you know what i thin i think you've read what i said above and your trying to create some sort of excuse or for your bizarre behavior of monitoring my work i also believe you are one of the trance i reference except you could be worse your trying to use rules as a way to silence people when in fact they may not even be breaking the rules it's unfortunate i can only imagine the many contributors in this world who want to add to this article or have added but find their work deleted in a month notice also how you are so obsessed with the rules and other peoples work on trance yet you've added next to nothing to the article yourself you probably in reality know very little about the genre,0.1152,0.0492,you do what know you've
262,you represent the bottom of the at wikipedia at least based on your brain dead justification of pretending fox news bill show did not consistently destroy keith the show usually him week after week your from reality is a picture perfect example of how liberals think,0.0897,0.0618,you represent the of brain
263,no i got incorrectly banned which is why it was lifted and your whole tone is very sarcastic and rude not to mention you are trolling this page stop it,0.0903,0.0589,no i got rude sarcastic
264,the second time been spotted dog tim in a rubbish bin,0.0874,0.06,rubbish the second time a
265,it seems to me that i was right is stating that some wiki contributors are small minded little who resent anyone who knows more and better than themselves and who feel duty bound to correct them i see one of the posts that upset you is my copying quote of yet you allowed to state and this childish humour unblock me immediately and get a grown up life,0.0931,0.0561,it minded seems to little
266,what your do you or do you want the truth these are the flags of http en wikipedia org wiki byzantine empire what the problem,0.084,0.0617,your what or you the
267,why anyway well so far reason rules the neutrality is still up though threatened i believe that it would only be temporary intellectually i am actually rather satisfied to leave it at that but not for one thing i enjoy intellectual much too much all hail wikipedia ah for the days of learning for the sake of learning i raised the question as part of my pursuit here why why not timothy again there's not enough room for everyone so how were the selected selected we know who is included who was excluded or perhaps simply non included i e in to intentional exclusion what is more in view of the evolution of terrorism – to all and purposes – virtually into a timothy takes on a new relevance and intellectual philosophical challenge my fear is that the whole effort is loaded biased in violation of wikipedia rules the whole thing seems to be a to ride in on the of rand otherwise again why not timothy again he explicitly mentioned and is often discussed in terms of libertarianism she would him like a of course but then she would in utter disgust so if there's room only for one of the two why if i don't receive reasoned responses i will edit out again again boys and girls my emphasis is on a truly wikipedian neutral pov oh by the way regarding my being blocked on grounds of incivility no less who started all the trouble on the other hand does not get blocked he who refers to admins as vandal that's not incivility such double standards will not stand i'm just getting up here,0.0052,0.0026,intellectually anyway why rules far
268,choose your sir it has come to my attention that despite taking advantage of our first rate american education facilities you insist upon identifying as a my parents are were and they were amongst the most people i have ever had the of knowing indeed during this unfortunate period of my life that i have been forced to spend in bangladesh due to my father i am now convinced that bangladesh is the single most unworthy nation to exist i use are were because i regret to say my mother was struck dead by bangladesh and despite her state and lying i her loss greatly never have i felt more love for my country than now when i find myself forced away from it i have now given my heart and soul to the united states of america the greatest country in the world god bless every inch of it but after my experiences with i cannot allow for one such as yourself to off of the united states while offering nothing in return i you to either bangladesh and enjoy the of your life in the blessed free world or get the fuck out of my country you filthy ape sincerely yours a proud american,0.1003,0.0514,your sir choose come it
269,hitler all you forgot to add hitler here,0.0821,0.062,hitler all you hitler to
270,worst customer service,0.0851,0.0594,worst customer service
271,no need to justify yourself acted like a garden variety bully and you were spot on in your first message wording is everything and he chose the worst way to express himself but more importantly he paid more attention to my edit warring and to his authority than to the actions of a severely biased fellow wiki user who had used the admin noticeboard as a weapon rather than as an instrument it is people like or who make wikipedia such an experience overall at least intellectually,0.0896,0.0562,no need to bully justify
272,a cup of coffee for you style background color fdffe7 border 1px solid fceb92 style vertical align middle padding 5px style vertical align middle padding 3px get with coffee,0.0729,0.0687,a of cup you border
273,check this out dumb mexican http www com reports htm,0.0799,0.0611,dumb out this mexican check
274,i need to get unblocked you have gone too far i am not abusing attacking i am helping,0.085,0.0553,abusing have too gone far
275,why do you restore things with references why no ones does something with wikipedia is corrupt,0.0826,0.0569,why corrupt do restore you
276,what another great example of just how arrogant this really is i'm thinking of money in finding out his personality and giving him a lesson,0.0941,0.0492,arrogant what this great just
277,what the hell who whether or not it's notable it's a single in and can it continues a of a mini series of songs i guess this isn't an encyclopedia that anyone can edit if everything is just burned down by,0.083,0.0548,hell what the who whether
278,you want war you got it,0.0766,0.0589,you war want you got
279,oh yeah well your a ha 2 4 08,0.0714,0.0624,a ha well your 2
280,my dead thanks a lot i have a job as i m 20 old i dont need mommy to give me money unlike yours who as too sleep for,0.0747,0.0593,dead a my a thanks
281,yes it is this is not an encyclopedia it is a reference for stupid people who lack knowledge her his point of views is perfectly acceptable and should be added to the main article thanks,0.082,0.0531,stupid encyclopedia this is not
282,ok now you're just being a vandal software is not a topic it's a label for computer software that is on you also vandalised my edits which removed unencyclopedic information it is for this that i know you have no interest in improvement only in undoing my i repeat unless you find a source that actually defines this as a topic and not the label it actually is it will continue to be a redirect deleting referenced material i did not i turned it into a redirect and as it's a label and the source refers to the label of a very specific area of computer software which isn't a topic it has no encyclopedic content to merge,0.0808,0.0528,you're just vandal being now
283,there is no verbatim dump of the i wrote the text and used the document as the source nothing was copied at all i don't think you know the law relating to the internet is an open network if work is submitted on the internet and its is used elsewhere for non profit is not a university document is a reliable source they are regarded as the most reliable as they are independent this was undertaken by two and leeds it is published i gave the link stored at cambridge you obviously don't like it but that is how it is get over it i will put the section back on you should have some respect to others who put some proper research into it just leave it alone it adds value it is clear you just removed the text because it never agreed to your you didn't even look at the link or contact me so i regard the the removal as vandalism thanks,0.0043,0.0018,there no is verbatim obviously
284,it seems that today you will broke all ur past record of pasting ur own views of non neutral and in nature then let it be i think you need some to assist ur biased mind because you can't change the truth so ur playing with wiki articles which don't suits to your ideology borrowed and taken from saudi kings dollars to spread and terrorism all over the world as your and taken some from more moderate majority group in u k and times online wrote about it in its survey then you could not digest it you dont want to see that report on wikipedia article so you have vandalized and this article by your useless editing i will see it very soon •,0.0977,0.0427,it will broke all seems
285,feeling sorry about greeks i actually feel sorry for those greeks on all and now here desperately trying to prove something in which by most of the causes it seems that they have no background i sure hope they will give up and let strikes among us and not funny nationalistic issues,0.0073,0.0042,sorry feeling about greeks feel
286,lol are you and still each other,0.0688,0.0601,you and are each still
287,consensus couldn't be clearer only because bullies like you were busy running people off like and last time,0.0756,0.0547,bullies off you running busy
288,did you even care to check the sources before you tagged the article you are sure in bad faith and running plain,0.0778,0.0529,care you even did bad
289,also that whole paragraph is full of spelling and grammatical errors and is rather badly written as well,0.0041,0.0031,errors full of also that
290,that's the most ridiculous thing i've ever heard let's say you had an important point to discuss about an article and so you posted on the discussion page wouldn't you think it's weird annoying uncalled for rude for someone to just go in and delete your discussion items and what if this happened to you about 20 times in one day,0.0924,0.044,ridiculous most the that's thing
291,the fact that you have no life but to be on wikipedia makes me,0.0765,0.0531,life the no fact have
292,i am disrupting this article an amazing amount of brain damaged administrators in defense of a vicious troll it has been a long critique from larry that wikipedia experts now at the wikipedia in defense of trolls ',0.0776,0.0522,vicious troll am i disrupting
293,and bible verses whoever is trying to use the bible as a source for wikipedia stop ya can't just start throwing bible verses around using the bible as a primary source that's stupid and also the source that was used for the bit did not actually say such acts as and homosexuality the only source that says that is duck dynasty nice try ignorant bigoted editors might please exercise a degree of self or integrity instead of lying about what sources say or absurd bible verses,0.0815,0.0495,ignorant stupid bigoted and homosexuality
294,put it up your bottom,0.0718,0.0557,up put your bottom it
295,i said gay and by that i meant happy of and where it says dicks i thought your names where richard so if being happy i'm sorry,0.0735,0.0543,gay dicks and by said
296,this guy should probably just jump from something,0.0691,0.0574,guy this jump should just
297,teabag yer because i did oh yer oh ya oh yes because i did,0.0717,0.055,because i did because yer
298,whoops there was documentation for the analogy being well received and it's very true despite the of gay mafia who try to manipulate wiki articles in order to advance their propaganda machine i fought these and nail a few years ago only to be or should i say haha by them these liberal use the rules of wiki to anyone who doesn't share their far left agenda it turns out that comparing to was a compliment and not an attack on a gay as some gay advocate so shocked haha suggested was not gay he was a normal man who had been raped as a young boy much like jerry raped those little boys in the penn state this of course led to engage in other gay activities despite his better judgement the man himself did not want to practice homosexuality but because of some gay pedophile he had his,0.0722,0.0543,gay gay gay gay whoops
299,what the is wrong with you,0.0716,0.054,what is the wrong with
300,outstanding indeed was it not taking offense at such a word as jackass is something that can only be accomplished by a jackass since only they know what it means to them it's vague and they decide their own shoe to fit them incidentally the vague article could use some clarity at least somewhere at the top it could define it next to ambiguous to indicate the distinct difference between them ambiguous actually has a 1 2 way explanation of their distinction on it's page i see,0.0649,0.0584,jackass jackass outstanding indeed something
301,you're being silly there is no san religion the title is merely a descriptive phrase or at least you could provide some of evidence that your objection has anything to do with reality as for moving the article several people had pointed out that the old name was spurious and in any case did it not describe the topic of the article no one has ever complained complained about the move the only question was whether it should be to san or to i initially chose san because i do not like the name but i changed my mind for consistency with this article your constant about irrelevant trivia is a waste of our time maybe you could address the issue at hand —,0.0749,0.0504,silly there being no is
302,i done a on your mother's,0.0666,0.055,a i on mother's done
303,it was in a sense it was also literal my talk page es en la florida shoot someone on mi property,0.005,0.0036,sense was it literal it
304,try and stop me i rule the world,0.0706,0.0502,stop and try me the
305,june 2006 utc yep welcome to wikipedia otherwise known as domain whatever she doesn't like she and always has some excuse about violating copyright etc even when there's no such violation especially if you're new then she accuses everyone who agrees with you of being a sockpuppet typical frustrated 00 48 21,0.0766,0.0461,violation a typical june sockpuppet
306,as an admin you have almost no basic reading and comprehension skills there once existed a 'the ' article with proper citations it has been deleted i tried to make a new page and find those citations i could not please die in a car crash,0.0744,0.0473,as admin almost an you
307,i'd rather not be part of your ego i know you're desperate to try and prove yourself with your on an internet site but stay away from my account thank you,0.07,0.0489,ego you're desperate your to
308,what could someone like you possibly know about anything go play with your,0.0688,0.0486,what could with possibly you
309,stop to be a you messed the article with wrong information fix it this is not brazil,0.0695,0.0475,a stop you messed be
310,oh no abusive language to an admin fine re edit with censorship disruptive editing is it you mean removing the vandalism by the user who reported me the user who information into an article even though numerous contributors have given references and then that user removes the references and what they wrote because its what they want yeah stuff official references by the actual band and the person who produced the band that editor knows the real deal and other contributors and myself who requested him her to stop this nonsense are the disruptive editors great admin work and that's not abusive language that's called sarcasm yeah expect people to remain calm and pleasant will such nonsense,0.0735,0.0442,abusive no oh language an
311,hi i think your sad and lonely and need to get a life or at least some friends thank you,0.067,0.0469,sad lonely and your a
312,i disagree several editors yourself included had agreed on this non contentious wording and now you are reverting,0.0031,0.002,disagree editors several i included
313,of,0.0603,0.0517,of
314,august 2008 it includes removing material however significant content are usually not considered to be vandalism where the reason for the removal of the content is readily apparent by examination of the content itself you didn't read did you such as those photos you're so upset about for no valid reason which you don't have oh i have no reasons okay do i still have to explain which is i notice in the quoted section cite since when does a photo require a cite i'm talking about the actual written content needing cite not the 40 something redundant photos there besides you don't even seem to own them photos and own i don't see you contributing in the form of removing misinformation just because you don't see doesn't mean i haven't contributed why don't you try adding sources instead of insults oh wait i should just kill myself first because the colors are hurting your eyes where exactly do you find credible sources on cars lol,0.0031,0.002,2008 includes usually however content
315,two in talkback,0.0041,0.0031,in two talkback
316,are you from the site,0.0606,0.0503,you are from the site
317,would it be a fair guess that both of you or at least one of you is sock account s it's either that or just one more example the wp tag that referred to,0.0048,0.0031,fair it would be a
318,i'd rather 1 compromise 2 see the anarcho capitalism article cut 3 see writers more and than i contribute i don't know who you are and where exactly you've found yourself in this discussion are you you seem,0.0699,0.0423,anarcho you've capitalism and are
319,i'm not very fond of you me for editing things when in fact i hardly use your website stop trying to get me to join up to your numbers and find a more effective way of harrassing people and or keeping them in check,0.0695,0.0409,very you not of fond
320,stop vandalizing please stop your disruptive editing and removing corrections to the unreliable and biased sources if you continue to vandalize wikipedia as you did at list of countries by population united nations and list of countries by population i will have to ask for an arbitration for of your access rights as well as to ask for protection of freedom and truth by blocking you from further editing — preceding unsigned comment added by the are out today this must be the record for time between visits by editors please undo the damage you are doing to wikipedia stop doing more damage and i will have no reason to leave any more messages on your talk page if you think you are right stop blocking me removing my edits and prove me wrong like this you are just showing you are arrogant and don't stand criticism of what you are doing you are just a petty person you can't win the argument so you are the other side in the talk go ahead block me but that won't change the fact that you are abusing the powers given to you and you don't stand criticism so go ahead abuse your powers again,0.0769,0.0366,disruptive stop stop vandalizing please
321,user direktor and yours sockpuppet is very dangerous to wikipedia he used this public instrument to make nationalistic if the others user lived in the old were in a tito prison wikipedia is a very dangerous place not neutral for peoples than work all the day to keep the propaganda style —preceding unsigned comment added by,0.0697,0.0401,sockpuppet dangerous yours very is
322,omg this show is so embarrassing to itself that it isnt even funny,0.0028,0.0015,embarrassing show so this itself
323,congratulations dennis now that you have put the on me is the very first edit the very first work well done and me at the same time adding salt on to the wound very good your plan has worked,0.0038,0.0027,now that dennis have put
324,hello wikipedia lover,0.0572,0.0459,hello wikipedia lover
325,instead an exaggerated response is made over the fact that he made some reference to a why is that worse than when the magnificent clean repeatedly used the f word at a woman but does not get punished,0.0616,0.0422,an instead exaggerated worse punished
326,i did not abuse and threaten another user came there out of nowhere and started a crisis by making abusive personal attacks on me i had to defend against them to every person who refused to ignore them it was not threatening to state the serious that would be committed if wikipedia claimed to even have even in theory any discretionary choice not to take entirely my side as the victim in such a situation the situation was an offence any organisation that decides to take offence at being told it does not have a discretionary choice to bully is corrupt admins here take personal bullying decisions without there being a defence process to go through that is judged by more than just the first other passing admin who acts on whim nobody can lose all rights without a defence process what you have just said does not add up legally you have put wikipedia on public record as blaming victims there is no prevention here of mob rule the public has to be warned so,0.0803,0.0323,i abuse abusive did not
327,oh come on that is a weak effort make it permanent so i can rid myself of wikipedia for good you protect the evil and punish me i can smell vote here one british admin and an evil british editor against poor me an 80 year old with one foot on a and the other in the grave none of this would have happened if wasn't so wicked the article had an issue with that i was trying to correct no wild indian is going to be in english that statement was and is completely false and misleading,0.071,0.035,come on weak a is
328,please refrain from making me you your edits appear to constitute masturbation and have been reverted or removed if you would like to experiment please use the sex room thank you,0.0549,0.0448,refrain making please from your
329,hey andy u r a,0.049,0.0498,a r andy hey u
330,i know how about european union even better i'm going to blow up all of europe,0.0605,0.0396,blow i union know european
331,now i understand why you are so willing to forget about what class university belongs to let me remind you your has not even been ranked by times until 2010 ignored you see lost are we talking about english grammar with a third class turkish university graduate give me a break,0.0039,0.0023,understand i willing now so
332,your note was not constructive and nor are your edits you set up and now you have reverted 3 times yourself so expect no sympathy,0.054,0.0421,your note up and was
333,more like,0.0503,0.0444,more like
334,i'm ignoring all the rules that's a wikipedia pillar the fact is i have been right all along and that jerk kept reverting the accurate edits block him so i him out about it he deserved it now move along and get a life i'm done here i made the accurate edits that are not in dispute and i expect them to stay that way you're not my boss,0.0648,0.0342,ignoring all rules the wikipedia
335,its good that this man is dead let it be clear to everyone that whoever insults turkey insults the deep nationalism of turks so he went to far and faced the consequences i say we have 1 problem less now,0.0601,0.0352,its dead is man good
336,very funny you really are a but very,0.0549,0.0378,a funny you very are
337,the purpose of categories is to group things of the same type together real things with real things fictional things with fictional things mixing real things and fictional things is a misuse of categories a real book is not and can never be a fictional library or a fictional the category about cities in england is irrelevant beyond the fact that things that are not cities in england shouldn't be categorized as cities in england it's not at all difficult to maintain a category for fictional things just don't add real things to it and if real things are added to it remove them but what the fuck ever tyranny of the minority is the rule of law on wikipedia and ultimately you're going to re add these categories regardless of how wrong and illogical it is so have at it real books as fictional libraries knock yourself out,0.0021,0.001,categories things purpose of the
338,4 million,0.0458,0.0448,4 million
339,i have to disagree i will not be changing my ways sorry if you want to block me then do it i won't stop you i have been blocked before and have only made new accounts to continue to tell these vandals how it really is i don't believe in treating them with respect they aren't people to me they are animals thanks,0.0577,0.0337,have i to will not
340,john wrestling abilities john cena is the worst in ring that i have ever seen and quite possibly the most ridiculous champion the wwe has ever had firstly he has no variation to his and the ecw crowd rightly said at one night old shit its not like the moves he has are even good for hi to continue using them although cena is a good quite frankly he is the worst wrestler i have seen in my life and as for him having a world title think it is absolutely preposterous he shouldn't even be in the should suit his half sloppy wrestling style better,0.0602,0.0322,worst shit ridiculous worst the
341,aids your account is now also closed due to pool aids sorry have some,0.0481,0.0398,aids is your account now
